{
  "id": "urn:ngsi-ld:Occurrence:ToiletsQueue",
  "type": "Occurrence",
  "dateCreated": "2026-10-14T09:00:00Z",
  "dateModified": "2026-10-14T09:00:00Z",
  "source": "https://saref.etsi.org/saref4wear/v2.1.1/",
  "dataProvider": "SAREF4WEAR",
  "name": "ToiletsQueue",
  "isDetectedBy": [
    "urn:ngsi-ld:WearableDevice:Receiver1"
  ],
  "takesPlaceAt": {
    "type": "Point",
    "coordinates": [
      13.405,
      52.52
    ]
  }
}
